<?xml version="1.0" encoding="utf-8"?>
<xs:schema xmlns:xs="http://www.w3.org/2001/XMLSchema">
  <xs:element name="tickets">
    <xs:complexType>
      <xs:sequence>
        <xs:element name="ticket" maxOccurs="unbounded" minOccurs="0">
          <xs:complexType>
            <xs:sequence>
              <xs:element type="xs:dateTime" name="submitdate"/>
              <xs:element type="xs:string" name="category"/>
              <xs:element name="user">
                <xs:complexType>
                  <xs:sequence>
                    <xs:element type="xs:string" name="id"/>
                    <xs:element type="xs:string" name="username"/>
                  </xs:sequence>
                </xs:complexType>
              </xs:element>
              <xs:element type="xs:string" name="description"/>
              <xs:element name="messages" minOccurs="0" maxOccurs="1">
                <xs:complexType>
                  <xs:sequence>
                    <xs:element name="message" maxOccurs="unbounded" minOccurs="0">
                      <xs:complexType>
                        <xs:sequence>
                          <xs:element type="xs:string" name="content"/>
                          <xs:element name="assignedstaff">
                            <xs:complexType>
                              <xs:sequence>
                                <xs:element type="xs:string" name="id"/>
                                <xs:element type="xs:string" name="firstname"/>
                                <xs:element type="xs:string" name="lastname"/>
                              </xs:sequence>
                            </xs:complexType>
                          </xs:element>
                        </xs:sequence>
                      </xs:complexType>
                    </xs:element>
                  </xs:sequence>
                </xs:complexType>
              </xs:element>
            </xs:sequence>
            <xs:attribute type="xs:string" name="id" use="required"/>
            <xs:attribute type="xs:string" name="status" use="required"/>
            <xs:attribute type="xs:string" name="priority" use="required"/>
          </xs:complexType>
        </xs:element>
      </xs:sequence>
    </xs:complexType>
  </xs:element>
</xs:schema>